phrasal verb;definition;Level;Lesson Number;Lesson Name
add up;To find the total of several numbers or amounts.;B1;14;Everyday Events & Reactions
add up to;if separate amounts add up to a total amount together they form that total;B1;13;Numbers, Money & Resources
ask out;to invite someone to go with you to a cinema restaurant etc because you want to start a romantic or sexual relationship with them;B1;1;Relationships & Social Life
back up;to make a copy of information on your computer;B1;6;Technology & Computers
blow up;To explode.;B1;14;Everyday Events & Reactions
break down;If a machine or vehicle breaks down, it stops working.;B1;14;Everyday Events & Reactions
break in (to);To enter a building illegally, usually by force.;B1;14;Everyday Events & Reactions
break up;if a meeting or other event breaks up or if you break it up it ends and people leave;B1;1;Relationships & Social Life
break up;if two people break up they end their relationship;B1;1;Relationships & Social Life
break up;to break something to make smaller pieces;B1;1;Relationships & Social Life
brighten up;if the weather brightens up it becomes sunnier;B1;2;Feelings, Moods & States
brighten up;to start looking or feeling happier;B1;2;Feelings, Moods & States
brighten up;to start to have more colour or light or give something more colour or light;B1;2;Feelings, Moods & States
bring up;To take care of a child until they become an adult.;B1;14;Everyday Events & Reactions
brush up (on);to practise and improve your skills or knowledge of something;B1;5;Work & Study Skills
build up;To increase or develop something gradually.;B1;14;Everyday Events & Reactions
bump into;to accidentally hit against something;B1;10;Movement & Encounters
bump into;to meet someone unexpectedly;B1;10;Movement & Encounters
call back;To phone someone again later.;B1;14;Everyday Events & Reactions
call off;To cancel an event or plan.;B1;14;Everyday Events & Reactions
calm down;To become calmer or to make someone calmer.;B1;14;Everyday Events & Reactions
carry on;To continue doing something.;B1;15;Communication, Progress & Daily Tasks
catch up (with);To reach the same point, level, or standard as someone else.;B1;15;Communication, Progress & Daily Tasks
change into;to stop being in one state condition or form and start being in another or make something do this;B1;9;Clothes & Appearance
change into;to take off the clothes or a piece of clothing you are wearing and put on different ones;B1;9;Clothes & Appearance
change out of;to take off the clothes or a piece of clothing you are wearing and put on different ones;B1;9;Clothes & Appearance
check out;to examine someone or something in order to be certain that everything is correct true or satisfactory;B1;3;Communication & Information
cheer up;To become happier, or to make someone happier.;B1;15;Communication, Progress & Daily Tasks
clear up;To tidy a place and make it clean and neat.;B1;15;Communication, Progress & Daily Tasks
come across;meet someone or find something by chance;B1;3;Communication & Information
come across;To find something by chance.;B1;15;Communication, Progress & Daily Tasks
come back (from);To return from a place.;B1;15;Communication, Progress & Daily Tasks
come on;Used to tell someone to hurry up.;B1;15;Communication, Progress & Daily Tasks
come out;be removed from something such as clothing or cloth by washing or rubbing;B1;3;Communication & Information
come out;become available to buy or see;B1;3;Communication & Information
come out;have a particular result or end in a particular way;B1;3;Communication & Information
come out;To be published or become available for people to buy or see.;B1;15;Communication, Progress & Daily Tasks
come round;go to a place where someone is especially their house in order to visit them;B1;1;Relationships & Social Life
come up with;think of something such as an idea or a plan;B1;4;Thinking & Problem Solving
cool down;become cooler or make something cooler;B1;12;Food, Cooking & Temperature
cross out;To draw a line through written words to show they are wrong or not needed.;B1;15;Communication, Progress & Daily Tasks
crowd around;move to a particular place at the same time as a lot of other people;B1;10;Movement & Encounters
cut down (on);To reduce the amount of something you do, eat, or use.;B1;16;Habits, Incidents & Practical Life
cut off;To disconnect something (electricity/phone), or to remove something by cutting.;B1;16;Habits, Incidents & Practical Life
cut out;remove something from a larger piece by cutting;B1;8;DIY & Building
do up;fasten (an item of clothing);B1;9;Clothes & Appearance
do up;To fasten buttons or a zip on clothes.;B1;16;Habits, Incidents & Practical Life
dry up;if something dries up or is dried up all the water comes out of it;B1;12;Food, Cooking & Temperature
eat out;To eat in a restaurant instead of at home.;B1;16;Habits, Incidents & Practical Life
end up;be in a particular place or state after doing something or because of doing it;B1;2;Feelings, Moods & States
fall behind;move more slowly than other people so that you are behind them;B1;10;Movement & Encounters
fall down;To trip and fall to the ground.;B1;16;Habits, Incidents & Practical Life
fall out (with);To have an argument with someone and stop being friendly.;B1;16;Habits, Incidents & Practical Life
figure out;be able to understand something or solve a problem or understand what someone is like and why they behave in the way they do;B1;4;Thinking & Problem Solving
fill in;To add information in the spaces on a form or document.;B1;16;Habits, Incidents & Practical Life
fill up;To make something completely full.;B1;16;Habits, Incidents & Practical Life
find out;To discover information.;B1;16;Habits, Incidents & Practical Life
get into;if a train plane etc gets into a place it arrives there;B1;10;Movement & Encounters
get into;start enjoying something or become enthusiastic about it;B1;10;Movement & Encounters
get through (to);be connected to a place by telephone;B1;3;Communication & Information
go off;leave a place especially for a particular purpose;B1;11;Travel & Journeys
go together;if two things go together they seem good natural or attractive in combination with each other;B1;9;Clothes & Appearance
hang out;spend time in a particular place or with particular people;B1;1;Relationships & Social Life
heat up;make something hot become hot;B1;12;Food, Cooking & Temperature
keep up;continue to do something;B1;5;Work & Study Skills
keep up;move at the same speed as someone or something;B1;5;Work & Study Skills
key in;put information into a computer or other electronic machine using keys or a keyboard;B1;6;Technology & Computers
knock/pull/tear down;destroy a building or wall;B1;8;DIY & Building
laze around;relax and enjoy yourself doing no work;B1;2;Feelings, Moods & States
lock up;lock all the doors and windows of a building so that no one can get in;B1;7;Home & Living
make up;work at different times from usual because you have not worked enough at the normal times;B1;5;Work & Study Skills
meet up;come together with someone either unexpectedly or as planned;B1;1;Relationships & Social Life
mess about/around;behave in a silly way;B1;2;Feelings, Moods & States
mess about/around;spend time doing things in a relaxed way;B1;2;Feelings, Moods & States
mess up;make a mistake or do something badly;B1;4;Thinking & Problem Solving
mess up;make something dirty or untidy;B1;4;Thinking & Problem Solving
mix up;put things together without any order;B1;4;Thinking & Problem Solving
mix up;think that one person or thing is another person or thing;B1;4;Thinking & Problem Solving
move in (with);start living in a different house or flat (with);B1;7;Home & Living
move on;leave one place and travel to another;B1;11;Travel & Journeys
move out;permanently leave the house or flat where you live or the place where you have your business;B1;7;Home & Living
move over;change your position in order to make space for someone or something;B1;11;Travel & Journeys
open up;open a locked door container or building;B1;7;Home & Living
pass on;give someone something for example a message that someone else has given you;B1;3;Communication & Information
pay back;give someone the same amount of money that you borrowed from them;B1;13;Numbers, Money & Resources
pick up;go and meet someone or something that you have arranged to take somewhere in a vehicle;B1;5;Work & Study Skills
pick up;improve;B1;5;Work & Study Skills
pick up;learn a new skill or start a habit without intending to;B1;5;Work & Study Skills
pull over;stop by the side of the road in a car or other vehicle;B1;11;Travel & Journeys
put in;fix something such as equipment in the place where it will be used and make it ready to use;B1;8;DIY & Building
put together;make something by joining all its parts;B1;8;DIY & Building
put up;let someone stay in your house;B1;7;Home & Living
put up;build something such as a wall fence or house;B1;8;DIY & Building
read up (on/about);get information on a particular subject by reading a lot about it;B1;5;Work & Study Skills
set down;write something on a piece of paper so that it will not be forgotten and can be looked at later;B1;3;Communication & Information
set up;make a piece of equipment ready for use;B1;6;Technology & Computers
set up;build a structure or put it in a particular place;B1;8;DIY & Building
smarten up;if you smarten up or smarten yourself up you make yourself look tidy and clean;B1;9;Clothes & Appearance
smarten up;improve the appearance of something for example by cleaning or painting it;B1;9;Clothes & Appearance
stand out;be easy to see or notice because of being different;B1;9;Clothes & Appearance
step aside;move so that someone can pass you;B1;11;Travel & Journeys
stop off;visit somewhere before continuing to another place;B1;11;Travel & Journeys
switch on/off;start/stop a machine light etc working;B1;6;Technology & Computers
take after;look or behave like an older relative;B1;1;Relationships & Social Life
take away;remove one number or quantity from another number or quantity;B1;13;Numbers, Money & Resources
take down;write down information or a statement;B1;3;Communication & Information
take off;have a particular amount of time away from work;B1;5;Work & Study Skills
take out;take someone to a place like a cinema or a restaurant and usually pay for them;B1;1;Relationships & Social Life
talk over;discuss a problem or a plan;B1;3;Communication & Information
test out;try using something such as a machine or product to find out whether it works correctly or is satisfactory;B1;6;Technology & Computers
think over;consider a problem or decision carefully;B1;4;Thinking & Problem Solving
throw out;get rid of something that you no longer want for example by putting it in a dustbin;B1;7;Home & Living
tip up;turn a container upside down so that the things inside it come out;B1;13;Numbers, Money & Resources
turn into;change or develop into something different;B1;2;Feelings, Moods & States
turn into;make someone or something change or develop into something different;B1;2;Feelings, Moods & States
use up;use all of a supply of something;B1;13;Numbers, Money & Resources
warm up;prepare for a sport or activity by doing gentle exercises or practising just before it starts;B1;12;Food, Cooking & Temperature
water down;add water to a drink or liquid in order to make it less strong dilute;B1;12;Food, Cooking & Temperature
wear out;use something a lot so that it no longer works or can no longer be used;B1;9;Clothes & Appearance
wind down;relax after a period of excitement or worry;B1;2;Feelings, Moods & States
